南屯區,建物,臺中市南屯區保安十街１５號,0.0,住,,,1090801,土地0建物1車位1,一層,15,店面(店鋪),見其他登記事項,鋼筋混凝土造,1080825,165.59,0,1,1,有,有,無,34700,210,坡道平面,26.94,0,前四年租金為34700元，第五至七年租金為36700元，第八至十年租金為38700元。,RPTOMLRLQHPFFCB76CC
西屯區,房地(土地+建物)+車位,臺中市西屯區市政路５００號２８樓之５,12.88,其他,,,1090814,土地1建物1車位1,二十八層,29,辦公商業大樓,見其他登記事項,鋼骨鋼筋混凝土造,1011219,243.25,0,0,0,無,有,無,56000,230,坡道機械,0.0,0,,RPTSMLRLQHPFFCB17CC
西屯區,房地(土地+建物)+車位,臺中市西屯區市政路５００號４樓之５,11.1,其他,,,1090813,土地1建物1車位1,四層,29,辦公商業大樓,見其他登記事項,鋼骨鋼筋混凝土造,1011219,209.87,0,0,0,無,有,無,50000,238,坡道平面,0.0,0,,RPPTMLRLQHPFFCB86CC
西屯區,房地(土地+建物),臺中市西屯區市政路３８６號７樓之２,18.55,其他,,,1090811,土地1建物1車位0,七層,38,辦公商業大樓,見其他登記事項,見其他登記事項,0990604,293.16999999999996,0,0,0,無,有,無,69000,235,,0.0,0,,RPWTMLRLQHPFFCB57CC
西屯區,房地(土地+建物)+車位,臺中市西屯區市政北二路２３８號２９樓之５,19.86,其他,,,1090820,土地1建物1車位2,二十九層,36,辦公商業大樓,見其他登記事項,鋼骨鋼筋混凝土造,1030403,372.57,0,0,0,無,有,無,105176,282,坡道平面,0.0,0,,RPSNNLRLQHPFFCB66CC
西屯區,房地(土地+建物)+車位,臺中市西屯區西苑一街７７號,19.61,住,,,1090804,土地1建物1車位1,五層,15,住宅大樓(11層含以上有電梯),見其他登記事項,鋼筋混凝土造,1081005,89.98,2,2,1,有,有,有,32100,357,坡道平面,33.45,0,,RPUOMLSLQHPFFCB96CC
西屯區,房地(土地+建物)+車位,臺中市西屯區市政北一路７７號８樓之６,12.33,其他,,,1090824,土地1建物1車位1,八層,15,辦公商業大樓,見其他登記事項,鋼筋混凝土造,0850903,96.91,0,0,0,無,有,有,23000,237,坡道機械,0.0,0,,RPSPMLSLQHPFFCB86CC
南屯區,建物,臺中市南屯區河南路四段４５６之８號九樓,0.0,,,,1090812,土地0建物1車位0,九層,14,住宅大樓(11層含以上有電梯),住家用,見其他登記事項,0931206,147.59,3,2,1,有,無,有,28000,190,,0.0,0,,RPSRMLSLQHPFFCB07CC
西屯區,房地(土地+建物)+車位,臺中市西屯區西屯區台灣大道四段１２６８號１５樓之３,15.49,住,,,1090827,土地1建物1車位1,十五層,26,住宅大樓(11層含以上有電梯),住家用,鋼筋混凝土造,1020125,189.31,3,2,2,有,有,有,32000,169,坡道平面,22.56,0,,RPTUMLSLQHPFFCB47CC
南屯區,房地(土地+建物)+車位,臺中市南屯區大富街８９號,62.64,住,,,1090817,土地1建物1車位2,全,4,透天厝,見其他登記事項,鋼筋混凝土造,0870602,173.57,5,2,4,有,有,有,40000,230,坡道平面,63.44,0,,RPWUMLSLQHPFFCB77CC
南屯區,建物,臺中市南屯區黎明東街３９９號十一樓之１,0.0,住,,,1090801,土地0建物1車位1,十一層,16,住宅大樓(11層含以上有電梯),住家用,鋼筋混凝土造,0840817,82.34,2,1,1,有,有,有,17000,206,坡道機械,0.0,0,,RPPVMLSLQHPFFCB17CC
西區,房地(土地+建物)+車位,臺中市西區五權西路一段２３７號１０樓之３,15.53,商,,,1090824,土地1建物1車位1,十層,16,辦公商業大樓,商業用,鋼筋混凝土造,0810804,232.19,0,0,0,無,有,無,42000,181,坡道機械,0.0,0,,RPWNMLSLQHPFFAB86CC
西區,房地(土地+建物),臺中市西區臺灣大道二段１８１號１１樓之１９,7.0,住,,,1090824,土地1建物1車位0,十一層,113,辦公商業大樓,見其他登記事項,鋼筋混凝土造,0840628,40.44,0,0,0,無,有,無,8500,210,,0.0,0,,RPXNMLSLQHPFFAB96CC
南區,建物,臺中市南區學府路１４６巷１５號９樓之２０,0.0,,,,1090729,土地0建物1車位0,九層,21,住宅大樓(11層含以上有電梯),見其他登記事項,鋼筋混凝土造,0850627,86.55,2,2,1,有,無,有,11700,135,,0.0,0,社會住宅包租代管案件租金市價打9折。,RPWOMLSLQHPFFAB96CC
北屯區,建物,臺中市北屯區柳陽東街４５之２號,0.0,住,,,1090807,土地0建物1車位0,見其他登記事項,13,店面(店鋪),住商用,鋼筋混凝土造,0840515,126.28,2,1,3,有,有,有,25500,202,,0.0,0,租金調漲：第六年起租金調整為26000元/月,RPTPMLSLQHPFFBB86CC
北區,建物,臺中市北區進化北路４３０巷３８之１號,0.0,,,,1090731,土地0建物1車位0,二層,5,公寓(5樓含以下無電梯),住家用,見其他登記事項,0690115,73.15,3,1,1,有,無,有,13000,178,,0.0,0,社會住宅包租代管案件租金市價打9折。,RPVPMLSLQHPFFBB07CC
北區,房地(土地+建物),臺中市北區進化北路３１７號１２樓之１８,5.37,商,,,1090805,土地2建物1車位0,十二層,18,住宅大樓(11層含以上有電梯),住家用,鋼筋混凝土造,0941208,68.09,1,0,0,無,有,有,14000,206,,0.0,0,,RPOQMLSLQHPFFBB09CC
北區,車位,臺中市北區進化北路３１７號等公共設施,0.38,商,,,1090810,土地0建物0車位1,,,其他,,,,27.9,0,0,0,有,有,無,3500,,坡道平面,0.0,3500,,RPPQMLSLQHPFFBB56CC
太平區,房地(土地+建物),臺中市太平區永平路二段４７６巷１００弄２２號,493.0,工,,,1090826,土地1建物1車位0,見其他登記事項,2,廠辦,見其他登記事項,鋼筋混凝土造,1010105,194.66,0,2,2,有,無,無,75000,385,,0.0,0,,RPOPMLSLQHPFFJB27DC
太平區,房地(土地+建物),臺中市太平區永平路二段４７６巷１００弄９號,360.0,工,,,1090801,土地1建物1車位0,見其他登記事項,1,廠辦,見其他登記事項,鋼筋混凝土造,1080401,172.26,1,1,2,有,無,無,72000,418,,0.0,0,,RPWOMLSLQHPFFJB87CC
清水區,房地(土地+建物)+車位,臺中市清水區港新五路２３９號１１樓之１,13.09,商,,,1090826,土地1建物1車位1,十一層,15,住宅大樓(11層含以上有電梯),見其他登記事項,鋼筋混凝土造,1080327,105.21000000000001,2,2,1,有,有,有,14000,133,坡道平面,33.76,0,,RPVNMLSLQHPFFFB27CC
大里區,建物,臺中市大里區瑞和街６號六樓,21.39,住,,,1090817,土地0建物1車位0,六層,7,華廈(10層含以下有電梯),見其他登記事項,鋼筋混凝土造,0830509,133.97,3,2,2,有,無,有,17200,128,,0.0,0,含管理費,RPSNMLSLQHPFFIB27CC
大里區,建物,臺中市大里區好來七街２１之４號,0.0,,鄉村區,乙種建築用地,1090730,土地0建物1車位0,四層,7,華廈(10層含以下有電梯),見其他登記事項,鋼筋混凝土造,0810430,91.09,3,2,2,有,無,有,11700,128,,0.0,0,社會住宅包租代管案件租金市價打9折。,RPOOMLSLQHPFFIB96CC
大里區,建物,臺中市大里區大明路４８６號二十二樓,0.0,商,,,1090810,土地0建物1車位1,二十二層,26,住宅大樓(11層含以上有電梯),見其他登記事項,鋼筋混凝土造,1031022,98.72,2,2,1,有,有,有,19000,192,坡道機械,9.59,0,租金含管理費。,RPTOMLSLQHPFFIB47CC
太平區,房地(土地+建物),臺中市太平區宜昌路３２２號７樓,5.02,住,,,1090801,土地1建物1車位0,七層,12,套房(1房1廳1衛),見其他登記事項,鋼筋混凝土造,0821231,36.82,1,1,1,有,有,有,4000,109,,0.0,0,,RPQNMLKMQHPFFJB56DC
太平區,建物,臺中市太平區成功東路３２１巷３號７樓,0.0,住,,,1090815,土地0建物1車位0,七層,7,華廈(10層含以下有電梯),見其他登記事項,鋼筋混凝土造,0820503,104.71,2,1,2,有,無,有,10000,96,,0.0,0,108年度台中市政府包租代管計畫,RPRNMLLMQHPFFJB66CC
太平區,建物,臺中市太平區文林街３５巷１６號,0.0,,鄉村區,乙種建築用地,1090828,土地0建物1車位0,全,4,透天厝,住家用,鋼筋混凝土造,0820424,169.95,5,2,3,有,無,有,20000,118,,0.0,0,108年度台中市政府包租代管計畫,RPSNMLLMQHPFFJB76CC
太平區,房地(土地+建物),臺中市太平區中山路一段２４５巷１８號７樓之１９,6.64,,鄉村區,乙種建築用地,1090828,土地1建物1車位0,七層,10,華廈(10層含以下有電梯),見其他登記事項,鋼筋混凝土造,0880909,20.28,1,0,1,有,有,有,3800,187,,0.0,0,臺中市包租代管案件租金市價打9折。,RPXNMLLMQHPFFJB27CC
太平區,房地(土地+建物),臺中市太平區中山路二段４７７巷１１６弄４２號,83.06,,鄉村區,乙種建築用地,1090828,土地1建物1車位0,全,2,透天厝,住家用,加強磚造,0660508,83.98,3,2,2,有,無,有,13500,161,,0.0,0,臺中市包租代管案件租金市價打9折。,RPOOMLLMQHPFFJB09CC
太平區,房地(土地+建物),臺中市太平區新平路二段５５巷３號,126.49,住,,,1090825,土地1建物1車位0,全,1,透天厝,住家用,加強磚造,0631220,49.15,2,2,1,有,無,有,16000,326,,0.0,0,臺中市包租代管案件租金市價打9折。,RPPOMLLMQHPFFJB56CC
豐原區,土地,西湳北段399地號,1444.28,,特定農業區,農牧用地,1090827,土地1建物0車位0,,,其他,,,,0.0,0,0,0,有,無,無,19800,14,,0.0,0,上有未保存登記廠房連同出租,RPPOMLLMQHPFFDB58CC
大里區,房地(土地+建物),臺中市大里區新生路１０１之３號,27.91,住,,,1090824,土地1建物1車位0,三層,5,公寓(5樓含以下無電梯),見其他登記事項,鋼筋混凝土造,0710207,86.19,3,2,1,有,無,有,13500,157,,0.0,0,臺中市包租代管案件租金市價打9折。,RPOPMLLMQHPFFIB09CC
大里區,房地(土地+建物)+車位,臺中市大里區中興路一段３８２巷４１號１４樓,13.83,住,,,1090826,土地1建物1車位1,十四層,14,住宅大樓(11層含以上有電梯),見其他登記事項,鋼筋混凝土造,0820916,99.83000000000001,3,2,2,有,有,有,17100,171,坡道平面,0.0,1200,臺中市包租代管案件租金市價打9折。因此案件為社會住宅包租代管案件因素，此租約訂定金額不含管理費、車位租金，管理費、停車位費用為承租人另行支付。,RPTRMLLMQHPFFIB17CC
梧棲區,建物,臺中市梧棲區大仁路一段６１巷５０號２樓之３,0.0,住,,,1090801,土地0建物1車位0,二層,6,華廈(10層含以下有電梯),見其他登記事項,鋼筋混凝土造,1080130,78.67,2,1,1,有,無,有,13800,175,,0.0,0,108年度台中市政府包租代管計畫,RPXNMLLMQHPFFFB86CC
沙鹿區,建物,臺中市沙鹿區樂群新莊１０９之２號３樓,0.0,農,,,1090830,土地0建物1車位0,三層,3,公寓(5樓含以下無電梯),住家用,加強磚造,0680223,102.84,2,2,1,有,無,有,10000,97,,0.0,0,108年度台中市政府包租代管計畫,RPPOMLLMQHPFFFB78CC
清水區,房地(土地+建物)+車位,臺中市清水區港新三路３０號３樓之２,22.09,商,,,1090828,土地1建物1車位1,三層,15,住宅大樓(11層含以上有電梯),見其他登記事項,鋼筋混凝土造,1070926,197.32999999999998,4,2,2,有,有,有,28000,142,坡道平面,32.25,0,,RPUOMLLMQHPFFFB66CC
清水區,房地(土地+建物),臺中市清水區港新五路２１３號１１樓之３,12.86,商,,,1090819,土地1建物1車位0,十一層,15,住宅大樓(11層含以上有電梯),見其他登記事項,鋼筋混凝土造,1060905,97.41,2,2,1,有,有,有,15000,154,,0.0,0,臺中市包租代管案件租金市價打9折。,RPRPMLLMQHPFFFB09CC
北區,土地,賴厝段149-70地號,146.0,住,,,1090826,土地1建物0車位0,,,其他,,,,0.0,0,0,0,有,無,無,42000,288,,0.0,0,,RPWNMLLMQHPFFBB98CC
北區,建物,臺中市北區中清路一段８０號８樓之１２,0.0,商,,,1090812,土地0建物1車位0,八層,13,住宅大樓(11層含以上有電梯),住家用,鋼筋混凝土造,0850601,33.77,1,0,1,有,無,有,6800,201,,0.0,0,108年度台中市政府包租代管計畫,RPVPMLLMQHPFFBB09CC
北屯區,建物,臺中市北屯區東山路一段４９之１２號５樓,0.0,住,,,1090831,土地0建物1車位0,五層,8,華廈(10層含以下有電梯),住家用,鋼筋混凝土造,0840525,109.30000000000001,2,2,2,有,無,有,13600,124,,0.0,0,108年度台中市政府包租代管計畫,RPWPMLLMQHPFFBB56CC
北屯區,建物,臺中市北屯區柳陽西街１２４號４樓,0.0,住,,,1090820,土地0建物1車位0,四層,7,華廈(10層含以下有電梯),住家用,鋼筋混凝土造,0830909,153.76,3,2,2,有,無,有,20000,130,,0.0,0,108年度台中市政府包租代管計畫,RPXPMLLMQHPFFBB66CC
北區,建物,臺中市北區英士路８巷４號,0.0,,,,1090828,土地0建物0車位0,全,5,透天厝,住家用,鋼筋混凝土造,0821122,13.24,1,0,1,有,無,有,4200,317,,0.0,0,,RPOQMLLMQHPFFBB48CC
北屯區,建物,臺中市北屯區建和路一段９９號７樓之１,0.0,住,,,1090820,土地0建物1車位0,七層,12,住宅大樓(11層含以上有電梯),住家用,鋼筋混凝土造,1001221,127.78,2,1,1,有,無,有,14500,113,,0.0,0,108年度台中市政府包租代管計畫,RPPQMLLMQHPFFBB58CC
北區,建物,臺中市北區中清路一段８２２之８４號,0.0,商,,,1090825,土地0建物1車位0,七層,11,住宅大樓(11層含以上有電梯),住家用,鋼筋混凝土造,0700814,35.84,1,0,1,有,無,有,9900,276,,0.0,0,108年度台中市政府包租代管計畫,RPRQMLLMQHPFFBB78CC
北區,房地(土地+建物),臺中市北區學士路２２８之３號,29.64,住,,,1090826,土地1建物1車位0,三層,5,公寓(5樓含以下無電梯),住家用,鋼筋混凝土造,0680303,84.38,3,2,2,有,無,有,17000,201,,0.0,0,臺中市包租代管案件租金市價打9折。,RPUQMLLMQHPFFBB09CC
北區,房地(土地+建物),臺中市北區漢口路四段６８號４樓之１２,5.05,住,,,1090801,土地1建物1車位0,四層,14,套房(1房1廳1衛),住家用,鋼筋混凝土造,0850715,46.08,1,1,1,有,有,有,4500,98,,0.0,0,,RPWQMLLMQHPFFBB66CC
北區,房地(土地+建物),臺中市北區漢口路四段６８號４樓３,8.42,住,,,1090801,土地1建物1車位0,四層,14,套房(1房1廳1衛),住家用,鋼筋混凝土造,0850715,30.880000000000003,1,1,1,有,有,有,4800,155,,0.0,0,,RPXQMLLMQHPFFBB76CC
北屯區,房地(土地+建物),臺中市北屯區昌平路二段１０巷７２弄１１１之５號,16.07,住,,,1090826,土地1建物1車位0,六層,7,華廈(10層含以下有電梯),住家用,鋼筋混凝土造,0800208,104.02000000000001,3,2,2,有,有,有,16100,155,,0.0,0,臺中市包租代管案件租金市價打9折。,RPOSMLLMQHPFFBB68CC
西區,建物,臺中市西區民生路４６９號三樓之２,0.0,,,,1090813,土地0建物1車位0,三層,5,公寓(5樓含以下無電梯),住家用,鋼筋混凝土造,0740529,80.7,3,2,2,有,無,有,18100,224,,0.0,0,,RPUNMLLMQHPFFAB68CC
中區,建物,臺中市中區中華路一段１２１號１４樓之１８,0.0,商,,,1090801,土地0建物1車位0,十四層,19,住宅大樓(11層含以上有電梯),見其他登記事項,鋼骨鋼筋混凝土造,0850520,34.08,1,1,2,有,無,有,11000,323,,0.0,0,108年度台中市政府包租代管計畫,RPOOMLLMQHPFFAB18CC
中區,建物,臺中市中區三民路二段１７巷４號３樓之６,0.0,商,,,1090810,土地0建物1車位0,三層,5,公寓(5樓含以下無電梯),住家用,鋼筋混凝土造,0760521,25.37,1,0,1,有,無,有,4000,158,,0.0,0,108年度台中市政府包租代管計畫,RPQOMLLMQHPFFAB38CC
西區,建物,臺中市西區公正路２６４巷３號５樓,0.0,住,,,1090815,土地0建物1車位0,五層,5,公寓(5樓含以下無電梯),住家用,鋼筋混凝土造,0761110,123.03,3,2,2,有,無,有,13500,110,,0.0,0,108年度台中市政府包租代管計畫,RPROMLLMQHPFFAB48CC
南區,建物,臺中市南區正義街３３號５樓之６,0.0,商,,,1090817,土地0建物1車位0,五層,11,住宅大樓(11層含以上有電梯),住家用,鋼筋混凝土造,0681004,75.17,2,1,1,有,無,有,7500,100,,0.0,0,108年度台中市政府包租代管計畫,RPSOMLLMQHPFFAB58CC
南區,建物,臺中市南區美和街１０６號１０樓之３,0.0,住,,,1090825,土地0建物1車位0,十層,13,住宅大樓(11層含以上有電梯),住家用,鋼筋混凝土造,0840117,106.2,2,2,1,有,無,有,15000,141,,0.0,0,108年度台中市政府包租代管計畫,RPVOMLLMQHPFFAB88CC
西區,房地(土地+建物),臺中市西區忠勤街１２號５樓之５,6.72,住,,,1090818,土地1建物1車位0,五層,14,住宅大樓(11層含以上有電梯),見其他登記事項,鋼筋混凝土造,0840401,74.89,2,1,1,有,無,有,16200,216,,0.0,0,臺中市包租代管案件租金市價打9折。,RPOPMLLMQHPFFAB28CC
西區,房地(土地+建物),臺中市西區忠勤街１２號５樓之５,6.72,住,,,1090818,土地1建物1車位0,五層,14,住宅大樓(11層含以上有電梯),見其他登記事項,鋼筋混凝土造,0840401,74.89,2,1,1,有,有,有,16200,216,,0.0,0,臺中市包租代管案件租金市價打9折。,RPQPMLLMQHPFFAB48CC
南區,房地(土地+建物)+車位,臺中市南區新榮街９７號６樓,13.19,商,,,1090824,土地2建物1車位1,六層,13,住宅大樓(11層含以上有電梯),見其他登記事項,鋼筋混凝土造,0960927,148.75,3,2,2,有,有,有,17100,115,坡道平面,0.0,2755,臺中市包租代管案件租金市價打9折。因臺中市包租代管試辦計畫因素，此租約訂定金額不含管理費、車位租金，管理費、停車位費用為承租人另行支付。,RPVPMLLMQHPFFAB98CC
西區,建物,臺中市西區大忠南街６１號四樓之一,0.0,商,,,1090805,土地0建物1車位1,四層,15,住宅大樓(11層含以上有電梯),見其他登記事項,鋼筋混凝土造,0950810,159.05,3,2,2,有,有,有,28000,176,坡道平面,20.18,0,,RPXPMLLMQHPFFAB56CC
西區,房地(土地+建物),臺中市西區民生路１９７號９樓之１５,8.93,商,,,1090824,土地1建物1車位0,九層,12,住宅大樓(11層含以上有電梯),住家用,鋼筋混凝土造,0780515,66.32000000000001,2,1,1,有,有,有,13500,204,,0.0,0,臺中市包租代管案件租金市價打9折。,RPOQMLLMQHPFFAB38CC
西屯區,建物,臺中市西屯區上石南六巷６之７號,0.0,,,,1090812,土地0建物1車位0,五層,5,公寓(5樓含以下無電梯),住家用,鋼筋混凝土造,0780224,30.88,1,0,1,有,無,有,7000,227,,0.0,0,,RPTNMLLMQHPFFCB78CC
西屯區,建物,臺中市西屯區烈美街１００號５F-２  A室,0.0,住,,,1090829,土地0建物0車位0,五層,5,套房(1房1廳1衛),見其他登記事項,鋼筋混凝土造,1081007,12.97,1,0,1,有,有,有,11600,894,,0.0,0,,RPVOMLLMQHPFFCB09CC
南屯區,房地(土地+建物),臺中市南屯區向心路１０９號１１樓１３,3.56,住,,,1090801,土地1建物1車位0,十一層,23,套房(1房1廳1衛),住家用,鋼筋混凝土造,0861216,47.230000000000004,1,1,1,有,有,有,8000,169,,0.0,0,,RPPQMLLMQHPFFCB68CC
西屯區,建物,臺中市西屯區烈美街１００號３F-２  C室,0.0,住,,,1090830,土地0建物0車位0,三層,5,套房(1房1廳1衛),見其他登記事項,鋼筋混凝土造,1081007,12.97,1,0,1,有,有,有,11600,894,,0.0,0,,RPSQMLLMQHPFFCB98CC
南屯區,建物,臺中市南屯區文心南五路一段３９３號９樓之２,0.0,住,,,1090825,土地0建物1車位0,九層,11,住宅大樓(11層含以上有電梯),見其他登記事項,鋼筋混凝土造,1080611,88.34,2,2,2,有,有,有,17100,194,,0.0,0,1.臺中市包租代管案件租金市價打9折。2.土地所有權人非建物所有權人，故土地持分坪數無法計算。,RPPSMLLMQHPFFCB88CC
南屯區,建物,臺中市南屯區文心南五路一段３９３號９樓之２,0.0,住,,,1090825,土地0建物1車位0,九層,11,住宅大樓(11層含以上有電梯),見其他登記事項,鋼筋混凝土造,1080611,126.61,3,2,2,有,有,有,18900,149,,0.0,0,1.臺中市包租代管案件租金市價打9折。2.土地所有權人非建物所有權人，故土地持分坪數無法計算。,RPQSMLLMQHPFFCB98CC
西屯區,建物,臺中市西屯區烈美街１００號５F-２  D室,0.0,住,,,1090826,土地0建物0車位0,五層,5,套房(1房1廳1衛),見其他登記事項,鋼筋混凝土造,1081007,12.97,1,0,1,有,有,有,12500,964,,0.0,0,,RPTNMLLJRHPFFCB58CC
南區,房地(土地+建物)+車位,臺中市南區文心南十路２１１號四樓之三,5.81,商,,,1090901,土地1建物1車位1,四層,32,住宅大樓(11層含以上有電梯),見其他登記事項,鋼筋混凝土造,0950622,132.91,2,2,2,有,有,有,20000,147,坡道機械,7.29,1500,,RPRNMLLJRHPFFAB18CC
西區,建物,臺中市西區忠明南路１２２號１０樓之６,0.0,其他,,,1090810,土地0建物1車位1,十層,24,住宅大樓(11層含以上有電梯),住家用,鋼筋混凝土造,0871030,217.25,2,2,2,有,有,有,40000,184,坡道平面,22.51,0,,RPXNMLLJRHPFFAB78CC
西區,房地(土地+建物),臺中市西區日興街１１９號,121.0,住,,,1090901,土地1建物1車位0,全,4,透天厝,住商用,鋼筋混凝土造,0691103,279.87,6,2,3,有,無,有,30000,107,,0.0,0,,RPROMLLJRHPFFAB28CC
北區,建物,臺中市北區崇德路一段２５６巷１號,0.0,住,,,1090812,土地0建物1車位0,一層,8,店面(店鋪),商業用,鋼筋混凝土造,0701212,153.59,1,2,2,有,有,無,45000,293,,0.0,0,,RPWPMLLJRHPFFBB98CC
北屯區,房地(土地+建物)+車位,臺中市北屯區水景街１３２號八樓之１,23.12,住,,,1090803,土地1建物1車位1,八層,14,住宅大樓(11層含以上有電梯),住家用,鋼筋混凝土造,1031021,148.77999999999997,3,2,2,有,有,無,25000,168,坡道平面,35.82,0,,RPUPMLLJRHPFFBB88DC
大里區,房地(土地+建物),臺中市大里區永興路２８巷１７號５樓,20.46,住,,,1090807,土地1建物1車位0,五層,5,公寓(5樓含以下無電梯),見其他登記事項,鋼筋混凝土造,0720125,61.88,2,1,1,有,無,有,10000,162,,0.0,0,臺中市包租代管案件租金市價打9折。,RPVNMLLJRHPFFIB86DC
大里區,房地(土地+建物),臺中市大里區益民路一段１５２之５號,28.24,住,,,1090810,土地1建物1車位0,五層,5,公寓(5樓含以下無電梯),住家用,鋼筋混凝土造,0690105,81.22,3,2,1,有,無,有,12000,148,,0.0,0,臺中市包租代管案件租金市價打9折。,RPPOMLLJRHPFFIB98DC
清水區,房地(土地+建物),臺中市清水區港新五路２０７號６樓之６,12.74,商,,,1090817,土地1建物1車位0,六層,15,住宅大樓(11層含以上有電梯),見其他登記事項,鋼筋混凝土造,1061027,96.87,2,2,1,有,有,有,18500,191,,0.0,0,,RPWRMLMJRHPFFFB07CC
清水區,房地(土地+建物)+車位,臺中市清水區港新五路２１７號１４樓之２,19.12,商,,,1090829,土地1建物1車位1,十四層,15,住宅大樓(11層含以上有電梯),見其他登記事項,鋼筋混凝土造,1060905,146.11,2,2,2,有,有,有,18000,123,坡道平面,34.35,0,,RPQSMLMJRHPFFFB56CC
沙鹿區,房地(土地+建物),臺中市沙鹿區中山路中峰巷１６０弄３號,287.69,住,,,1090901,土地2建物1車位0,全,4,透天厝,見其他登記事項,鋼筋混凝土造,1080322,52.55,4,2,5,有,無,無,22000,419,,0.0,0,,RPWTMLMJRHPFFFB27CC
潭子區,房地(土地+建物)+車位,臺中市潭子區中山路一段７巷４９號１１樓,14.95,住,,,1090820,土地1建物1車位1,十一層,13,住宅大樓(11層含以上有電梯),住家用,鋼筋混凝土造,0840110,121.19,3,1,2,有,有,有,16000,132,坡道機械,0.0,300,臺中市包租代管案件租金市價打9折。因此案件為社會住宅包租代管案件因素，此租約訂定金額不含管理費、車位租金，管理費、停車位費用為承租人另行支付。,RPPNMLMJRHPFFHB78CC
大里區,房地(土地+建物),臺中市大里區內元路２００號７樓,22.39,住,,,1090817,土地1建物1車位0,七層,10,華廈(10層含以下有電梯),見其他登記事項,鋼筋混凝土造,0830323,186.75,2,2,2,有,有,有,17100,92,,0.0,0,臺中市包租代管案件租金市價打9折。,RPVNMLMJRHPFFIB86CC
北屯區,建物,臺中市北屯區東山路一段２２０之３號,83.0,住,,,1090813,土地0建物1車位0,全,4,透天厝,住家用,鋼筋混凝土造,0840513,220.25,5,2,4,有,無,無,30000,136,,0.0,0,,RPUNMLMJRHPFFBB68CC
北屯區,建物,臺中市北屯區文昌東四街７０號,0.0,住,,,1090810,土地0建物1車位0,見其他登記事項,5,店面(店鋪),住商用,鋼筋混凝土造,0730620,109.47,1,2,2,有,無,有,25000,228,,0.0,0,,RPPRMLMJRHPFFBB58CC
西屯區,建物,臺中市西屯區大弘街６２號,0.0,住,,,1090814,土地0建物1車位0,見其他登記事項,4,店面(店鋪),商業用,鋼筋混凝土造,0710630,93.26,0,1,1,有,無,有,20000,214,,0.0,0,,RPTSMLMJRHPFFCB56CC
西屯區,建物,臺中市西屯區西屯路二段上石北２巷２２之２號,0.0,商,,,1090814,土地0建物0車位0,一層,8,套房(1房1廳1衛),住家用,鋼筋混凝土造,0820218,33.82,1,0,1,有,有,有,6500,192,,0.0,0,部分承租。公設面積無法分算。租金含管理費、水費。,RPVOMLNJRHPFFCB09CC
南屯區,建物,臺中市南屯區東興路三段２２５號七樓,0.0,住,,,1090815,土地0建物1車位1,七層,14,住宅大樓(11層含以上有電梯),住家用,鋼筋混凝土造,0960920,211.82999999999998,3,2,2,有,有,有,35000,165,坡道平面,15.03,0,,RPWOMLNJRHPFFCB56CC
南屯區,建物,臺中市南屯區惠文路６８６號,0.0,住,,,1090815,土地0建物1車位0,全,4,透天厝,住家用,鋼筋混凝土造,0840512,339.13,4,3,4,有,有,有,50000,147,,0.0,0,租金含管理費。房屋用途做住家及店面營業使用。,RPVPMLNJRHPFFCB56CC
西屯區,建物,臺中市西屯區惠中路一段８８號１７樓之２,0.0,其他,,,1090810,土地0建物1車位2,十七層,28,辦公商業大樓,見其他登記事項,見其他登記事項,1061229,492.97,0,0,0,無,有,無,171488,348,坡道機械,26.52,0,,RPXPMLNJRHPFFCB76CC
西屯區,建物,臺中市西屯區惠中路一段８８號２７樓,0.0,其他,,,1090814,土地0建物1車位3,見其他登記事項,28,辦公商業大樓,見其他登記事項,見其他登記事項,1061229,1231.03,0,0,0,無,有,無,469211,381,坡道平面,66.28,0,,RPOQMLNJRHPFFCB58CC
南屯區,建物,臺中市南屯區文心南五路一段３９３號５樓之３,0.0,,,,1090804,土地0建物1車位0,五層,11,住宅大樓(11層含以上有電梯),見其他登記事項,鋼筋混凝土造,1080611,126.61,3,2,2,有,無,有,19800,156,,0.0,0,社會住宅包租代管案件租金市價打9折。,RPTQMLNJRHPFFCB09CC
